{"schema_version":1,"nodes":[{"kind":"intent","namespace":"checkout","key":"safe-cancel","text":"Users can cancel an order","span":{"start":16,"end":81}},{"kind":"claim","namespace":"checkout","key":"rejects","text":"Shipped orders are rejected","span":{"start":82,"end":143}},{"kind":"assumption","namespace":"checkout","key":"state-authoritative","text":"Shipment state is authoritative","span":{"start":144,"end":231}},{"kind":"open-question","namespace":"checkout","key":"after-label","text":"Can cancellation happen after a label?","span":{"start":232,"end":324}}],"evidence":[{"namespace":"checkout","key":"verified","method":"case","subject":{"kind":"claim","namespace":"checkout","key":"rejects"},"outcome":"pass","execution":{"runner":"cargo-test","target":"aarch64-apple-darwin","source_commit":"deadbeef","artifact_digest":"sha256:abc","sampling":{"cases":3,"seed":42,"generator":"checkout-generator","shrinks":[8,3,1],"coverage":{"smoke":3}}},"provenance":{"producer":"lsharp-test","tool_version":"0.2","timestamp":"2026-07-25T00:00:00Z"},"independence":"same-author"}],"edges":[{"relation":"motivates","intent":{"namespace":"checkout","key":"safe-cancel"},"claim":{"namespace":"checkout","key":"rejects"}},{"relation":"constrained-by","claim":{"namespace":"checkout","key":"rejects"},"assumption":{"namespace":"checkout","key":"state-authoritative"}},{"relation":"tested-by","claim":{"namespace":"checkout","key":"rejects"},"contract":{"namespace":"checkout","key":"case"}},{"relation":"supports","observation":{"namespace":"checkout","key":"verified"},"claim":{"namespace":"checkout","key":"rejects"}}]}